subreddit,text,label
ptsd,"Didn't know if I was locked in, had suffered brain damage from lack of oxygen, I had no idea what was happening.",1
ptsd,"I quit Facebook, Twitter, and Instragram, essentially shutting myself off from the world.",1
ptsd,I feel good just feeling like nobody notices me.,1
ptsd,"Well, I had a bad binge eating episode and stopped, and my father proceeded to stop talking to me.",1
ptsd,"I’ve done a lot of reflecting on my childhood, trying to figure out if there were times he was like this that I had normalized, but with my therapist and my mother we have concluded that he never used to be like this.",1
ptsd,"I honestly dont think i can live long with this, but i do care about her and want to do something back for her.",1
ptsd,I was pretty much done with my live and lost all fate and interest in things.,1
ptsd,It all is just so tiresome you know?.,1
ptsd,"They always tend to worry, so this was something I knew they really couldn't do anything about so I didn't want them to worry for nothing.",1
ptsd,There's also just the mental health stigma and as a guy that makes it harder too.,1
ptsd,I also have a sister that I have never been very close to.,1
ptsd,"I first thought it‘s just something physical, the lack of iron in my blood or something.. never thought it would be something this deep.",1
ptsd,"I’m not sure if this makes a difference, but my mom also had it for a while when my dad died, so I’m not sure if that has any effect on me or not.",1
ptsd,"His mom came, he freaked out and got angry.",1
ptsd,He almost slammed the door on his mom's head/hand and I freaked out and pushed him away from the door.,1
ptsd,His mom freaked out over the condition he was in.,1
ptsd,"I never doubted reality before the abuse, and I have never done so outside of the abuse.",1
ptsd,"I know it's a young relationship, but it's hard adjusting to changes especially since i went from seeing him every day to not seeing him at all anymore.",1
ptsd,Friday i had a woodworking competition and everything went really good at first but then it just got worse and worse and my ptsd started to kick in.,1
ptsd,I felt really aggressive and angry and sad all at once.,1
ptsd,My friends saw that there was something going on and asked what was going on but at that moment everything that gets told is getting picked up as bad in my head so it only made me angry'r.,1
ptsd,"It was my dream to win this competition, i practiced so hard and then this happened and to make it worse i had a really bad dream the night before that everything was going bad etc and well the dream came true.",1
ptsd,"- mum was disabled in a wheelchair at times, in and out of hospital all the years I was growing up.",1
ptsd,I'm not upset with him for having a panic attack.,1
ptsd,On the way back up the stairs her knee started to hurt or she hit or whatever.,1
ptsd,"She was sitting on the stairs just sobbing away, doing her thing where she's cussing under her breathe.",1
ptsd,I've been sleeping on the couch since March.,1
ptsd,I had dreams of stuff he did to me in that bed.,1
ptsd,It didn't go away until the next day.,1
ptsd,Thanks.. **Edit 2** I forgot to say that my father is a completely different person now - but when I see him so much as take a sip of alcohol it all floods back to me and I get extremely terrified and nervous.,1
ptsd,I feel like I’m suffocating him.,1
ptsd,"This happened pretty often and I never really paid no mind to it, once again, I was a kid and didn't really think anything of it.",1
ptsd,I remember her taking me to my grandparents (her side) for the weekend quite a few times - and being horribly saddened by just being dumped off by her so she could go see different men.,1
ptsd,Once I was fifteen (february of '06) I got into an argument with my father and I wasn't taking his BS anymore.,1
ptsd,Sure maybe amother day will creep up and it'll feel like someone hit the reset button on your world again.,1
ptsd,"According to my mom, I didn't start talking until I started preschool at 4 years old, and still wouldn't talk at home... but teachers said that I wouldn't stop talking at school.",1
ptsd,"the reality is no matter how bad or how old he is, he is still her son and she cant shake off that biological attachment she has towards him and not worry about him.",1
ptsd,I was very severally bullied by the kids there.,1
ptsd,"When I do open up, all I can think is ""He's probably bored and wishing I'll stop talking.""",1
ptsd,He has voiced his frustration that he can't relate and that I struggle.,1
ptsd,It is so hard for me to think he knew any better.,1
ptsd,I find it frustrating though as i have just drove someone away who i really liked.,1
ptsd,He has ended up deleting and blocking me as he didnt at all help with reassurance which just made my mind go into overdrive creating scenarios that were probably non existent.,1
ptsd,This situation was over the top and heartbreaking that my parents would rather not work with a therapist (i've even suggest family therapy) and just decide to ban me from the house.,1
ptsd,I understand that isolating myself from them is the best option and I know it will be hard.,1
ptsd,I dont know what to make of him telling me I only care about being right.,1
ptsd,"But sometimes I feel bad that he has to see me freak out, or the flashbacks.",1
ptsd,When I black out.,1
ptsd,I feel bad.,1
ptsd,"She has trust issues after suffering abuse from her birth parents at a young age, and her situation is only complicated further with bipolar depression and fetal-alcohol syndrome.",1
ptsd,I know I sound like a total stalker but I was just really obsessed and I regret everything I did now that I'm older and wiser.,1
ptsd,"I don't savour these atrocities, but I feel like I must keep consuming them.",1
ptsd,I just don't know.,1
ptsd,I almost started crying but I didnt know why.,1
ptsd,It all gets mixed up in my head.,1
ptsd,"She pretty much ruined my life, and I experienced all kinds of abuse while I was with her (and even when we were apart), including emotional, mental and physical.",1
ptsd,People are abrasive and mean and stupid and they shit on each other all the time and are presumptive.,1
ptsd,Blame everything that we're not fucking perfect.,1
ptsd,I'm a bit jumpy as well as a bit of an animated person.,1
ptsd,He will become extremely anxious and at times very angry.,1
ptsd,"When I asked him how I could be better at helping him through it, he became even more upset stating that he always tells me what to do and I need to figure this out on my own.",1
ptsd,"There are many events thaat I have PTSD from, but somehow, even though it was one of the hardest things I have ever done.",1
ptsd,Made her feel shitty.,1
ptsd,I feel really guilty over it.,1
ptsd,"I know part of the problem may be how much I've repressed and can't feel, but...",1
ptsd,"I don't know, I feel I've exaggerated so much.",1
ptsd,"I haven't been having nightmares, and my ""flashbacks"" don't feel like flashbacks so much as ""regressive anxious states.""",1
ptsd,"I can think of the trauma I've been through and talk about it, but it doesn't feel like anything disturbing.",1
ptsd,"About 5 years ago I started feeling small signs of PTSD but just brushed it off like it wasn’t a real thing until it just kept getting worse and eating away at me, until I realized enough is enough.",1
ptsd,I thought maybe I have PTSD but then I would contradict myself and say that it’s not real and I don’t have it which would make me feel worse.,1
ptsd,"I have complex PTSD which I have only just been diagnosed with, prior to this they diagnosed me with borderline personality disorders and bipolar which are now not correct.",1
ptsd,"I came to realize later - and I denied it, basically just calling it a celebrity crush and nothing more - that I was in love with this musician.",1
ptsd,"I've mentioned very vaguely that I live with PTSD and ""blah blah childhood trauma, et cetera"".",1
ptsd,All of the other kids didn’t know whether to cry with him or look on in horror at the situation.,1
ptsd,I have a VA disability rating of 40% due to PTSD/Anxiety/depression and ringing in my ears from a tour in Afghanistan.,1
ptsd,just moved for a job in DC and my old unit is now too far to travel to.,1
ptsd,"For some background, I recognize that I tend to overreact to normal things, I have panic attacks when people innocently flirt with me for example, and I’ve flown off the handle when too many men have even just looked at me in too short of a space of time.",1
ptsd,She was really worried about being retraumatized by her birth.,1
ptsd,But he is phoning me today yelling and accusing me of paranoid stuff and hanging up.,1
ptsd,"I know I’m going to get kicked, I know I’m going to be in pain but I also see the beauty in between the clouds.",1
ptsd,My traumas now seem to have died down a bit and do not easily control my emotions and thinking.,1
ptsd,"Sometimes I wake up at this point, and sometimes I don't, but I always remember it the next morning.",1
ptsd,“How do you know?” I’ve been at lower points in my life.,1
ptsd,it's not the drugs i need.,1
ptsd,i'm only 22.,1
ptsd,"She said she wouldn't abandon me, she would sit with me, but that she couldn't ""be"" with me, affected as I was by the alcohol.",1
ptsd,I've dealt with treatment resistant depression since I was a child.,1
ptsd,I put a pillow over my face and at this time it all becomes a blur.,1
ptsd,I'm not a patient person and this illness is really making me fed up to the point where I'm getting angry!,1
ptsd,"I have PTSD, and have for about 15 years with varying degrees of symptom severity after a sexual assault.",1
ptsd,Largely I am only dealing with nightmares and a heightened startle response and doing really well overall.,1
ptsd,"I grew up in an abusive home for years, and it wasn't until my mid 20's that I began come to terms with how subtly that had affected me over the years.",1
ptsd,"I remember after I had explained my traumas and symptoms to my current therapist, I asked her if I it was true that I had something wrong with me (my psychiatrist had told me the week prior that much of what I was experiencing aligned with the PTSD diagnosis and I was startled).",1
ptsd,"Shell shocked, I told my mom about it in the car and she made it very clear to me how there was no way in her mind that it could be that serious.",1
ptsd,I'm just saying my frustrations out into the void.,1
ptsd,"Since this happened i've become introverted, i don't particularly like anyone (because unfortunately, i now tend to focus on the bad side in people), and i attempt to not get past small talk.",1
ptsd,"I started freaking out, went to the hospital because I couldn't breath.",1
ptsd,Occasionally I still feel anxiety when alone and bored at my house.,1
ptsd,My depression is now not a problem at all but the legacy it left is annoying.,1
ptsd,I feel so terrible being honest about that evil summer but recognizing my post traumatic stress makes me so happy.,1
ptsd,"I don't think my childhood was exceptional, just frustrating.",1
ptsd,The traumatic event was when I was forced to take it by friends when I was severely ill and could have used a nine-one-one call instead.,1
ptsd,"He couldn’t understand what was happening, so he thought my husband was trying to hurt me instead of himself.",1
ptsd,This was my first time ever being away from my family for more than a day at a time.,1
ptsd,Not wanting it to happen So.... Just drunk?,1
ptsd,"Last week it happened so many times in one trip I decided to go to urgent care about it (at one point I was driving with my window down, in hail, slapping myself in the face to stay alert).",1
ptsd,I've been through sooo much for so long.,1
ptsd,"Acid isn’t for all, and I didn’t take it for a fucking therapy session—but, here I am sat down in front of paper and pastels on a wood floor, not thinking about whatever happened to me however long ago.",1
ptsd,Plus I know filing a claim at the VA is humiliating and I don’t want to go though what others I fear have.,1
ptsd,"And 2) I kind of want to tell the most recent guy that him confessing that to me made me uncomfortable, but I don't know if I should or not.",1
ptsd,"We started having sex, and right off the bat I could tell this was weird.",1
ptsd,"2) I feel safer to wear a heavy coat at work, I know it looks unprofessional and my boss constantly asks me to take it off.",1
ptsd,I have a situation where I am not sure what advice to give.,1
ptsd,"She has BPD or something much like it, and can become very emotional, begin panicking about the potential of abandonment, and threatening suicide, to cut of all her hair etc.",1
ptsd,"During the pregnancy and after the birth (traumatic) of our first child in 2013, symptoms began to intensify, including a lot of depression, manic behaviour and periodic outbreaks of anger.",1
ptsd,I haven't seen her in six and a half years.,1
ptsd,"According to the messages of injury they received from their attackers, they will not only feel the effects of anxiety and depression, but also a deep shame of being ""defective"" or ""not good enough"".",1
ptsd,I don't blame her at all for this behavior but I really need help understanding her before I get hurt worse than I already have.,1
ptsd,TL;DR I sometimes feel like pretending to have PTSD despite never expecting me to have it and then get an official diagnosis from a doctor.,1
ptsd,I feel like I'm starting to regain control of my life slowly.,1
ptsd,"I asked my doctor to lower my Effexor because I feel like the side effects outweigh the good he does: it doesn't really help my anxiety, I feel depersonalised since I'm on medication and finally it gives me uncontrollable desires.",1
ptsd,"I didn't think that talking about anything would affect my bipolar disorder, and I **really** didn't want to talk about my trauma.",1
ptsd,Then I suddenly looked at the door and I totally waited for my student comrade to pop out screaming at how I told our advisor.,1
ptsd,I'm pretty broke and almost all my money for now goes towards bills and food.,1
ptsd,"It's crazy how DEEP these emotional scars and injuries are, that I literally wept much harder in this session, than in the treatment even waking up in a hospital bald!",1
ptsd,I also felt someone sitting on my bed next to me when I tried to leave the light and sleep.,1
ptsd,"I didn't hear distant voices like the other time I was this 'hypervigilant, but I heard a little rusty noise in the closet (just a house noise I guess) and it bothered me.",1
ptsd,I am overwhelmed by looking at all the options on amazon.,1
ptsd,Nor is it something I was willing to accept because... fuck... so many people have it worse than me.,1
ptsd,"Besides, I know that filing a claim at the VA is humiliating and I don't want to go even if what I'm afraid of others.",1
ptsd,"I am no longer bound to him, but that does not mean that I do not panic at the end of every day in the second split that I think it will happen again.",1
ptsd,I cut him off from my life.,1
ptsd,I went twice a week and felt that my whole life revolved around a trauma.,1
ptsd,So I feel a little lost with that.,1
ptsd,I've had asthma since I was a kid and it really went wrong in the last few weeks...,1
ptsd,I describe it as feeling in a fight (physically) although I'm sitting or trying to sleep.,1
ptsd,"Loss of fine motor skills, hypervigilance, sweeping of all environments and people as if they were about to hit me and I have to hit back.",1
ptsd,"I can't give them what they need, regular sex or emotional intimacy, and I just feel guilty.",1
ptsd,"I thought about going to HR about it, but I'm in a position where I can't compromise this job, and I'm not the most loved person on the team (nothing I did, I was hired outside for a position that 3 internals wanted), as far as value is concerned.",1
ptsd,"Recovery feels familiar, so it's less scary, but I'm also much tired of everything.",1
ptsd,I want to move on.,1
ptsd,"When this intense part fades, I'm just stuck in my head for the rest of the day, exhausted.",1
ptsd,"My grandmother was a slut to my mother, my mother was a slut to me, I had to act one way or another.",1
ptsd,"I write this, because I feel and try to avoid a complete panic attack.",1
ptsd,I was violent and my mother was afraid for her life.,1
ptsd,The first time I remember her telling everyone that she was afraid I would kill her I had about 7.,1
ptsd,"Basically, I'm just scared very easily and have a visible response.",1
ptsd,It's pretty embarrassing in social and professional contexts to the point that people think I'm pretending but I really can't control my reaction.,1
ptsd,I've been diagnosed Bipolar and BPD but this particular symptom doesn't really fit either.,1
ptsd,"So on top of my ""doom"" to my gloom..I am now f'n worried about my heart.",1
ptsd,"My mom then hit me with the newspaper and it shocked me that she would do this, she knows I don't like play hitting, smacking, striking, hitting or violence of any sort on my person.",1
ptsd,"And I address it immediately because this is the 4th time I have told him not to do these things, then my other friend who is driving nearly gets into an collision with another car i think because he was high on marijuana and the friend we are moving in the backseat is like ""you have to understand I was just trying to get your attention"" you know the thing 5 year olds do to get peoples attention by smacking them, this guy is in his 60's.",1
ptsd,"A number of times my life has been at risk, and I've had to defend myself a few times.",1
ptsd,"If anything goes wrong, sexually, I want to cease to exist, and a lot of the time, I'm not able to do it out of sheer anxiety.",1
ptsd,"I used to be a very soft person, and I hope I'm still kind, but now I'm quicker to anger, and I don't want to become an abuser.",1
ptsd,Basically... was I abused?,1
ptsd,I feel like I have the symptoms of PTSD.,1
ptsd,The fear is both physical and emotional.,1
ptsd,I’m so jumpy at work and at home.,1
ptsd,I feel like I’m seeing things everywhere and little waves of panic wash through me all day.,1
ptsd,I’m really just finding this incredibly difficult right now and needed to write it out I guess.,1
ptsd,"I have PTSD from my sexual abuse, and this week has been really hard.",1
ptsd,"Today, though, was really hard.",1
ptsd,And I don't ask for the nightmares to drain me of all energy and make me feel worse throughout the day the harder I try to be normal.,1
ptsd,"I was planning on seeking counselling without my parent's knowledge for this condition once I get to university and get settled, but now I'm wondering if I'm going to be told the same thing by a therapist there.",1
ptsd,"I'm sorry if this seems kind of ranty or rambling, my thoughts are a bit of a mess and I'm not sure what to think.",1
ptsd,"When I was a kid, I suffered a kind of unlikely injury that basically ruined me mentally, and it seems like I just CAN NOT get away from it, because it's such cheap gory shock value that everyone uses it when they need cheap gory shock value.",1
ptsd,And if I'm not mentally prepared to see it I have a panic attack or just start crying.,1
ptsd,"A fucking jokey homebrew cursed item on r/DND did that to me today, and I hate that my trauma is so bad that I have to stay guarded even when I'm just reading a funny thread about my favorite hobby.",1
ptsd,I'm still thinking about that fucking item.,1
ptsd,I'm so tired.,1
ptsd,I don’t know.,1
ptsd,I really don’t know what to make of the situation.,1
ptsd,"I get it, some people are just really stupid and ignorant and won't understand how the assault affected me.",1
ptsd,Having been ripped from my children and left on the streets is very hard and i honeslty want to give up.,1
ptsd,But the anxiety swirls to the point i keep trying to find where i went wrong.,1
ptsd,It replays and plays in my head over and over like a horror movie.,1
ptsd,The feeling of wanting to die because at that point i had nothing left.,1
ptsd,"I slipped and went on s bender, I fell into a depressive, suicidal crisis.",1
ptsd,I barely slept in the hospital because I stayed up at night and listened for codes with his room number.,1
ptsd,"I was terrified, constantly living in fear from the moment I awoke until about his 7th day in the hospital when he seemed clearer, and sat up with assistance for the first time.",1
ptsd,"We’ve been robbed of a normal engagement, of the experience of moving in together, and that’s a grieving process...but my mind...is not what it was.",1
ptsd,"But when my parents also failed to realise that my sister was on meth and neglecting her children, who are very dear to me, it sort of doubled the trauma and now I have full blown trauma.",1
ptsd,I feel like my parents just aren't trustworthy.,1
ptsd,How can they live in such an oblivious bubble?,1
ptsd,I wouldn't put any faith in them to protect me now and feel that I'm in this world on my own.,1
ptsd,I feel like I'm going to go insane.,1
ptsd,I can't stop crying or wanting to pull my hair out or screaming.,1
ptsd,I can't stop shaking.,1
ptsd,I'm on medications for anxiety and they help some but not much and not often...,1
ptsd,"Ultimately, I know I'm not me anymore.",1
ptsd,"My current boyfriend wasn't right, just a figure of the coma induced illusion.",1
ptsd,Now I'm scared to go back to sleep.,1
ptsd,"My ex, who abused me for 11 years, might be waiting tight there for me again.",1
ptsd,I wonder what I would be like if I had gotten help earlier on.,1
ptsd,I hate the word.,1
ptsd,"If someone asked me if I was, I'd deny it but I know I have PTSD and I guess that does make me ill by definition.",1
ptsd,Will I be considered mentally ill forever?,1
ptsd,I constantly have to do shit for these people.,1
ptsd,I hate the thought that even after my mom's death she still has power over me.,1
ptsd,I got bit in the leg and continued on like it was nothing.,1
ptsd,I only fell apart October 2016.,1
ptsd,"Hearing those words, I literally felt my chest rip open and haven't been able to close the wound since.",1
ptsd,I want to be able to deal with these feelings and move on.,1
ptsd,"I’ve talked briefly to a counsellor on the phone but besides talking about it making me cry, it hasn’t made me feel better.",1
ptsd,This is one of the worst PTSD episodes of my life.,1
ptsd,"I can’t predict how long this is going to go on and I’m sick of the weak, dissolving feeling I get whenever I think about it.",1
ptsd,"I’ve been trying to replace bad thoughts with good, I’ve tried CBT techniques, I’ve tried wallowing in the bad thoughts (as advised by someone over at r/emetophobia)... nothing has worked, I’m a mess.",1
ptsd,Every day I wake up doing nothing.,1
ptsd,"Absolutely nothing except wasting my life, hoping something would happen but of course nothing would happen because I am a lonely fuck who pushes away everyone in his life while everyone else goes out and party like there is no tomorrow and fuck and cum like they are in a porno and make memories that not even one memory book is enough.",1
ptsd,Every day I wake up doing nothing.,1
ptsd,"Either wasting my time playing videogames or watching the social media status scrolling up and up and up when in reality, i am doing absolutely nothing.",1
ptsd,"Nothing is being absorbed in that stupid brain of mine, wherever the hell it is when I should be doing something more productive like studying or reading but either my own brain rotted to the size of a pea *(because of how mental disorders degenerate brain cells ... yay me, I am doing something at all)* or it just felt and flew up to Mars, or it is sitting its dark throne,  rubbing its pitchfork,  planning its next move on how to fuck me, both literally and figuratively.",1
ptsd,"All these sexual abuse accusations, while wonderful to see so many men and women coming forward about sexual abuse, I just can't escape it.",1
ptsd,I haven't left the apartment in days and the only reliable form of self medication is too expensive (weed).,1
ptsd,I'm also autistic so I've noticed it's also overstimulating me to the point I'm hiding.,1
ptsd,It's just too much and I thank you for reading my vent.,1
ptsd,Sometimes I am shunmed I think because they mistake my interest in making friends for a romantic interest.,1
ptsd,I am quite annoyed by all the assumptions/game playing/projecting that goes on in the world.,1
ptsd,But I still froze and cried through the entire thing.,1
ptsd,"Some of the sensations brouvht me to memories of old sensations, andI felt really vulnerable, trapped, and ashamed, and I haven't been able to shake it off all day.",1
ptsd,"Part of it is that we have company staying in our home; so I don't feel like I have the space to care for myself, and it just further perpetuates the shame feeling.",1
ptsd,"In fact, I felt too ashamed to go home right after, and drove around for an hour and a half before I felt like I at least i wouldn't have to explain myself to my boyfriend's family.",1
ptsd,"Additionally, because it's my boyfriend's family, my boyfriend has been unavailable to me all day.",1
ptsd,The only time I feel 'comfortable in my own skin' is when I'm drunk and or stoned.,1
ptsd,"I'm 5 or so years out from the last experiences and have moved 800 miles away, completely cut off from all former contacts with the exception of one close friend.",1
ptsd,"Panic attacks, ruminating, depression, anger, the whole deal.",1
ptsd,The silent sadness that you feel for no apparent reason yet somehow you feel too weak or too much of a pussy to do anything about it or even think that you deserve better because you feel like you deserve whatever painful feeling you are going through You feel like you rather suffer a long and painful life rather than ending your life because you feel like you deserve whatever agony you are going through The anxiety and panic attack come and go whenever they please.,1
