subreddit,text,label
domesticviolence,But when she becomes abusive and manipulative it’s too much and she says she will change and she’s taking meds now and she booked a counselor but I don’t know if this is more manipulation and lies or if it’s real?,1
domesticviolence,I just don’t know.,1
domesticviolence,She’s had soooo many chances to do this but only after we have separated is she ever actually doing anything about it.,1
domesticviolence,"It honestly baffles me, which is why I wonder whether he's paying them off (he told me he'd done this while we were together, although that could've been a fear tactic).",1
domesticviolence,"I care so much for that man, I place myself in his shoes and feeling the pain he must be feeling being alone.",1
domesticviolence,"I know this is sick of me, but how do I stop this?!",1
domesticviolence,I shouldn’t feel bad for what he did right?,1
domesticviolence,"If I try to initiate sex which I have done many times in the past, he will flat out push me away.",1
domesticviolence,I can't even talk about the day she left me because it was so traumatic.,1
domesticviolence,I can't even admit it to myself.,1
domesticviolence,It was awful beyond words and I can't tell anyone.,1
domesticviolence,How can I see a therapist if I'm afraid I'm going to lose my shit just opening up about that one day?,1
domesticviolence,I feel like it would ruin any progress I've made...I'm afraid I'm going to be hiding forever.,1
domesticviolence,"I won't defend myself, I know I shouldn't have raised my voice and I should have left much much earlier.",1
domesticviolence,I don't know what to write past this point.,1
domesticviolence,I said come on you're going to make me late and he said well find the fucking car keys.,1
domesticviolence,Then honestly he was just going on and on and yelling at me and I tuned out what he was saying so I don't even remember.,1
domesticviolence,"This past week he's gotten really bad where he told her she couldn't use the house phone, her cell phone, the computer, the car, or even watch tv.",1
domesticviolence,I don’t know what to expect.,1
domesticviolence,I just want to not be so alone.,1
domesticviolence,"tl;dr boyfriend got aggressive and is jailed, how to tell young son why bf is gone now and we have to move soon?",1
domesticviolence,I kept on try to explain to him that I can't take him blaming me for everything and he believes everything he says so hard that every works out of my mouth is a lie.,1
domesticviolence,I tried telling him I am trying to fix myself.,1
domesticviolence,She doesn't pay for my tuition yet constantly puts me down by calling me dumb.,1
domesticviolence,He shouldn't be able to do that to anyone else.,1
domesticviolence,I'm just so scared.,1
domesticviolence,"I wasn't perfect either and I'm scared people won't believe me, or he will twist it so he's the victim and I'm the bad guy, although I know what happened was wrong and I have evidence that he knows what he did was wrong.",1
domesticviolence,"Im scared this will ruin my life, but I also can't bear the thought of him doing that to anyone else.",1
domesticviolence,"Even as I’m cooking, he’s still screaming in my face, telling me that I’m done at my job and I need to quit now.",1
domesticviolence,"I yell back, something about him not having a job and he grips me up from behind with an arm around my throat, and I grab the knife I was using to cut chicken and tell him to get off of me.",1
domesticviolence,"I’ve honestly lost my patience because I feel she should do something about it, but she won’t.",1
domesticviolence,She’s afraid to leave because he says he’ll accuse her of abandoning the home.,1
domesticviolence,I think she truly believes that because I am an adult now that all the screw ups all the pain I have been through is my own fault.,1
domesticviolence,"I know I may pay a price, for speaking openly in our small community.",1
domesticviolence,"I’m in Florida, can’t find concrete laws that apartment companies will let me off lease because of abuse.",1
domesticviolence,"We have had some physical altercations, like him pushing me down, poking me hard in the chest, him ripping off his shirt and than hitting me with it.",1
domesticviolence,"He’s also broken a few pairs of glasses, a remote control, smashed the hell out of his iPhone, and threw a chair across the room almost hitting his dog.",1
domesticviolence,So he hasn't really hit me since we got back together but he's cruel in so many other ways.,1
domesticviolence,He tells me I'm ugly and a dumb b****h and tells me I can't do anything right.,1
domesticviolence,He constantly calls me a whore.,1
domesticviolence,He constantly threaten to take our son and I’ll never see him again.,1
domesticviolence,He cussed me out and told me he not to talk to him until 1pm.,1
domesticviolence,So now I'm here not knowing what to do.,1
domesticviolence,I don't want to call the cops because I don't want my mom to get in any trouble for her gambling habits.,1
domesticviolence,**tl;dr**: My mom cuts her boyfriend because he grabbed her by the throat and I don't know what to do.,1
domesticviolence,"We will get through this and I am determined, even it means going to a shelter, to get affordable housing, so i never end up in this situation again!",1
domesticviolence,I'm so heartbroken I don't know what to do?,1
domesticviolence,Everyday I was told how worthless I was and was getting beat regularly.,1
domesticviolence,"She wants to do anything she can do to help me, but it's up to the state, not her, to charge me.",1
domesticviolence,Now I'm being charged with 4th degree DV and need legal counsel to prove my innocence.,1
domesticviolence,I'm clinging onto the last bit of hope I have.,1
domesticviolence,Wtf is wrong with this society?,1
domesticviolence,I’m pissed.,1
domesticviolence,I’m angry.,1
domesticviolence,I recently got out of a 2+ year abusive relationship and am now going to court against him with domestic violence charges.,1
domesticviolence,I am terrified to see my abuser in court and I was wondering what I should expect.,1
domesticviolence,I'm scared that I'm making the wrong descion.,1
domesticviolence,I actually do have access to some money where I believe I could pay off at least some of what I owe but I honestly don’t even know where I can get a number for the debts that I owe.,1
domesticviolence,"1) I am worried I might actually be in legal trouble over this, 2) I am afraid of seeking help from someone who isn’t understanding of my situation and will just be totally horrified about what a mess it is and they will be mean to me.",1
domesticviolence,I am NOT looking for a handout I just need help being walked through the steps of what I need to do to resolve this.,1
domesticviolence,Then I started to notice how much of a temper he has.,1
domesticviolence,Yesterday I was going to spend Christmas eve with him and his family and I tried bringing up some major concerns about the way things were going and he flipped out and started screaming and throwing shit.,1
domesticviolence,Am I nuts?,1
domesticviolence,Why am I so surprised i've come out looking like i've just had 10 round with Tyson?,1
domesticviolence,He has anger issues and he seems like a good guy sometimes (even though i know he's a fucking monster) and i know he's had a bad childhood.,1
domesticviolence,It's even harder because if he does get arrested or something for it my best friend won't have anyone to support her/pay for her tuition or her meals even... her mom doesn't have the money to do that and i think that's why she still stays with them... just so she can support her daughter.,1
domesticviolence,I really want to do something about it but idk what i can do.,1
domesticviolence,"Although I love him a lot, I don't exactly want the reason that I move in because he's trying to save me.",1
domesticviolence,I’m having a difficult time coping with how my abusive husband is perceived by family and friends.,1
domesticviolence,I sit next to him absolutely blank and speechless.,1
domesticviolence,If you intervene he will stoop down to the lowest level cursing his sons out with the worst imaginable.,1
domesticviolence,Am I imagining this or blowing it out of proportion?,1
domesticviolence,"Turns out I get really numb as the only way to not get dragged into this emotional swamp, but is a hell for its own.",1
domesticviolence,"But I told him that I’m not over it and his response was kinda like “ I feel so guilty, it makes my life hard, I wish you could just forgive me.” So now I feel pressured to forgive him and it’s frustrating because he didn’t give a damn about my feelings when I was 9 and crying my eyes out because I just saw my dad push mom and hit her.",1
domesticviolence,And I can’t help but feel like that fueled my brothers heroin addiction that almost killed him and still could cause he recently relapsed.,1
domesticviolence,I’m just so angry and I don’t want to be.,1
domesticviolence,What the hell can i do?,1
domesticviolence,"I'd let her hate me if it meant getting her safe, but I have no idea what this could do to the kids.",1
domesticviolence,"He works his ass off everyday, gives her money to pay bills, and she constantly goes gambling with her friend.",1
domesticviolence,I'm scared to start the eviction process but I NEED to protect myself and my son.,1
domesticviolence,"Hell, im even scared to  ask this asshole to take the trash out.",1
domesticviolence,I don't know what to do.,1
domesticviolence,I feel like an empty shell of a person with no strength to get out of this mess.,1
domesticviolence,"The worst situations were forcing me to make a statement I knew was untrue (in order to allow me to get ready for work); becoming sexually rough and chasing me into another room to force himself on me, and rages where I’ve felt threatened.",1
domesticviolence,So why do I still feel conflicted about leaving?,1
domesticviolence,I guess I need an extra push.,1
domesticviolence,With my ass still against the door I grab the overflowing laundry basket.,1
domesticviolence,Sit on the fucking thing.,1
domesticviolence,He keeps saying im crazy not respecting his space where i keep asking for things to be amicable over and over.,1
domesticviolence,he tells me its my fault that everytime hes done anything to me its because i started it.,1
domesticviolence,I honestly dont know if its true.,1
domesticviolence,Because i kept trying to tell him leave me alone.,1
domesticviolence,I don't know what to do.,1
domesticviolence,It's coming up so quickly and I'm feeling a twinge of anxiety as it gets closer.,1
domesticviolence,I keep telling myself I did everything I possibly could and that I should do what feels right to me even if it means I may feel like I'm going backwards at times.,1
domesticviolence,I also have to make a decision on if I want a permanent restraining order or a non violent contact order.,1
domesticviolence,"Myself and my brothers are contemplating getting a restraining order of some kind, but given how my dad operates, I'm not sure that will actually protect us from any harm.",1
domesticviolence,He spent most of the night afterhysterically crying telling me he can't live with himself after this and how he would never put his hands on a woman but something in him just snapped but I don't know how to forgive him or let it go.,1
domesticviolence,I'm still so shocked by what happened I have managed to stop crying and calm down but I don't know how to move on from here.,1
domesticviolence,I don't know what to do.,1
domesticviolence,"The police are no help as I'm usually tossed in the squad car and questioned like a fucking criminal because ""why would she lie?"".",1
domesticviolence,I can't keep the 2400 a month in child support up because I can't get a job (I usually make 3000 a month net) and I'm pretty sure I'm going to be homeless in a few days.,1
domesticviolence,All I want is to help my daughter and make sure she's safe and I've run out of ideas.,1
domesticviolence,"I continued fighting his hold and he kept saying my name in a gentle voice and telling me to calm down, saying that he loved me and didn't know why I was freaking out, and kept saying, ""you know you're not going to win.",1
domesticviolence,"As time went on I would here everyday how I was too skinny, I need to gain some weight.. it got to the point to where I would ask questions about why I wasn’t good enough and was depressed ... he would throw a speaker in a room along with me and put stuff in front of the door to where I couldn’t get out.",1
domesticviolence,I'm so tired of this.,1
domesticviolence,I hate that he saw that side of me.,1
domesticviolence,I don't want to look weak in front of him.,1
domesticviolence,I don't want to give up on him because he's never given up on me.,1
domesticviolence,How do I get help?,1
domesticviolence,"She tries to take her keys away from me and I refuse, which turns into a full-blown fight.",1
domesticviolence,"I have marks and bruises all over my arms and back, as well as deep scratches from her fingernails.",1
domesticviolence,"At one point, she had me on the floor, cornered on the steps, repeatedly slamming my head into the wall and shoving a loose key that fell off the keyring into my breast, still trying to get the rest of the car keys out of my hand.",1
domesticviolence,"I'm not saying I didn't retaliate, but I only went to far as to push her away, never hitting her intentionally but more as an act of defense.",1
domesticviolence,I asked him where he had been because i was starting to get worried.,1
domesticviolence,Next thing i knew he was behind me with his arm around my neck squeezing.,1
domesticviolence,He continued as he threw me on the couch and wrapped his legs around my stomach.,1
domesticviolence,"I was upset his friend brought him somewhere that he ran into a girl he loves, and even though it was just a second it really hurt me.",1
domesticviolence,He isn't fulfilling the courts orders that would get him a chance to petition for supervised visitation.,1
domesticviolence,It feels like he's completely just disappeared from being a father but I still feel like he's going to come back.,1
domesticviolence,"He ended up grabbing me by the neck with both hands and slamming my head against the wall in the hallway, he threw me the ground I hit the radiator and then he threw a bucket at me that had a toy and DOG SHIT in it (i genuinely don't think he knew there was dog shit in it, he just threw whatever was there...and our dog must have shit in it.)",1
domesticviolence,I got right up and ran up the stairs and told him to let me in to get my shit so I can go.,1
domesticviolence,He told me to leave and I started kicking the door and demanding he lets me into get my shit so I can go.,1
domesticviolence,He immediately started screaming at my friends to “get the fuck out” and aggressively pushing them out of the back door.,1
domesticviolence,He then grabbed me by my arm and shoved me out the door yelling “take her fucking ass with you.” My friends sat with me for a minute and asked if I wanted to leave with them.,1
domesticviolence,Nobody should ever have to put up with that and have to live in fear of someone who can fly off the handle like that.,1
domesticviolence,I'm just not sure what to do or how to approach this.,1
domesticviolence,I’ve received hundreds of harassing contacts from him and he’s even tried to extort my friendship back by threatening to expose sex tapes.,1
domesticviolence,I’ve had him flip friends on me and had to move twice in the past to years to hide my location from him.,1
domesticviolence,"I’m trying to tell myself it’s like being beat up on the street by a stranger - it’s only once, but it still happened and it’s traumatic.",1
domesticviolence,It was someone I loved and trusted and I can’t believe he could have done this.,1
domesticviolence,"When I pushed him back, telling him to quit, he kicked me down to the ground and heel kicked my back until I had a panic attack and collapsed unable to breathe...",1
domesticviolence,Why am I feeling like I miss him.. I’ve been okay for 7 damn days & then he texted my grandmother & asked me if I wanted him to mail me my stuff (a card) & now I’m starting to feel bad.,1
domesticviolence,Why is he seeming so decent now... Why do I feel so damn guilty.. why do I feel like I did something wrong.,1
domesticviolence,But I’ve been ignoring him.,1
domesticviolence,Why do I feel like I’m in the wrong.,1
domesticviolence,When I told my mom I was in such a bad mental space that I thought I was going to kill myself and didn’t feel safe to be alone she said I couldn’t come over.,1
domesticviolence,I feel scared and I don't know if this would escalate into something worse.,1
domesticviolence,This is a really shitty time to need support or therapy because it’s a holiday weekend.,1
domesticviolence,"I’m in horrible physical pain, emotionally heartbroken and being ignored by my kids until I turn them back over to him tomorrow.",1
domesticviolence,I don’t even know why I am posting.,1
domesticviolence,I don’t know what to expect.,1
domesticviolence,I just want to not be so alone.,1
domesticviolence,"I can't be in an abusive relationship, but I find my brain trying to rationalize this.",1
domesticviolence,"he could not understand why i resented him, when in his mind, it was ME who was being 'abusive'.",1
domesticviolence,"because i couldnt fake being into sex with him, which made me a 'bad girlfriend', because i wasn't ecstatic about always having to take on every responsibility and basically take care of him as if he were a child.",1
domesticviolence,WELL FUCK YOU.,1
domesticviolence,When does this feeling of guilt go away?,1
domesticviolence,"He has made me eat until I literally threw up, then forced me to eat my vomit.",1
domesticviolence,He will point guns at me.,1
domesticviolence,"Also, I didn't want to make things worse for her by sticking up for her in public.",1
domesticviolence,This household is screwing with all of us.,1
domesticviolence,"I want to move out, but I have nowhere to go, no job, and no money.",1
domesticviolence,I don’t know how to make him leave because he says if I do that he will go and dispute all the charges I ever made on his debit card and say it was fraud and he will have me prosecuted.,1
domesticviolence,"He says he will do whatever he can to ruin my life and see that I lose my job and lose the respect of everyone in my life and have legal consequences go using his money (which again, he said I could but now he’s saying I’m lying).",1
domesticviolence,I feel like he literally dictates my life.,1
domesticviolence,I close the door and put my back against it.,1
domesticviolence,"He's slamming into the door, trying to break into it, yelling that I'm crazy and I'm making everything up.",1
domesticviolence,"I'm terrified and sobbing, yelling for help and for him to leave me alone.",1
domesticviolence,At this point I'm begging him to let me get my phone to call my dad to come get me.,1
domesticviolence,"He finally tells me that I can, and that he can't wait for me to be gone.",1
domesticviolence,"Is it that the nerves have cleared, minute by minute anxiety calmed, hopelessness resolved, and now I have to sit a grieve a person I made up in my head?",1
domesticviolence,I am broken but I am piecing myself together.,1
domesticviolence,Part of me wants to wait shit out until my green card gets here and then leave him.,1
domesticviolence,"No this isn't just some edgy teen, oh I hate my dad, I have every reason to hate him, for what he has done, and continues to purposely do to me and my family.",1
domesticviolence,"For nearly killing me, for scarring us all to the point I can't even meet a nice person, or have any friends, and not wonder whether they do or don't treat their family like a lump of sh**.",1
domesticviolence,Nobody should have to call the police because they don't feel safe within their own home.,1
domesticviolence,"I could stay up here alone, but he says he’ll be where ever we are.",1
domesticviolence,I feel trapped and I think it’s making me like I’m acting like a child these days.,1
domesticviolence,He drained my accounts and I’m financially dependent because I fear not paying bills and I have to feed my daughter and myself.,1
domesticviolence,I love the type of father he is but I hate the way he treats me.,1
domesticviolence,I have no one to open up to or go to if I even tried to leave him.,1
domesticviolence,I’m tired of him abusing me mentally and physically me.,1
domesticviolence,He has cheated on me several times and each time it knocks my self esteem Lower and lower.,1
domesticviolence,I received the silent treatment from him and him being drunk and telling me that i'm worthless and don't do anything for him.,1
domesticviolence,He backed me into a corner in the kitchen and kept hitting me.,1
domesticviolence,"When he starting choking me, I bit the holy hell out of his arm to get him off.",1
domesticviolence,"I was so confuse and in tears I didn't know what to do, but cry.",1
domesticviolence,How do we deal with this?,1
domesticviolence,I guess that also comes with ignoring me all night.,1
domesticviolence,"Not being able to let go of the fact that I let this go on for so long, and even the fact that in my heart I still care and want him.",1
domesticviolence,"I know he will never be real, open or honest about who he is or what he did.",1
domesticviolence,"I have to forgive myself for letting this take over my life, my heart, my emotions.",1
domesticviolence,"The worst/best part of this story is that I am still with this prick, trying to get away safely.",1
domesticviolence,"No Idea why I am here, guess I just need to vent.",1
domesticviolence,"I hate how I am and I wish I could die right now, but I don't have the drive to do it myself anymore.",1
domesticviolence,How do I leave him if I know that life without him has been and will be a worse circle of hell?,1
domesticviolence,"I really don't know what to do, I moved down south to be with her and so I have no friends or family here.",1
domesticviolence,"Its also her place so Im scarred she is going to kick me out, she has used that against me in the past, it makes me feel very vunrable and scared.",1
domesticviolence,My family victim blames and they’re are ok with a multi millionaire pedophile in the family.,1
domesticviolence,So they’re disgusting and no help.,1
domesticviolence,"I’m moving soon if I can get a damn plan together to his parents, they understand he’s crazy, but he really messes with my head.",1
domesticviolence,I didnt know what to say or what I could do to help.,1
domesticviolence,"Sorry for the sad story, I just don't know what to do and it's painful to think what is happening to her right now.",1
domesticviolence,"I hope it bothers you oh so much, to know you hurt me all by touch.",1
domesticviolence,"Everything about you is so mean, I just wish you could get clean.",1
domesticviolence,He was going to choke the name out of me.,1
domesticviolence,I am his 24/7 caregiver i do not have time to cheat even if i wanted.,1
domesticviolence,He said i would die if i didnt tell him.,1
domesticviolence,"So i get on top of him and i say, don't you ever do that again.",1
domesticviolence,"Everytime, he gets mad he takes my phone or other items away from me and tells me he bought it so it's his.",1
domesticviolence,"I don't know what to do, but I'm tired of feeling trapped and helpless.",1
domesticviolence,"I’m terrified of him, and praying that he gets the real help he needs at the same time.",1
domesticviolence,And I just don’t know how to sort that out.,1
domesticviolence,"I don’t know how to stop worrying and wondering what he’s doing, we have several court dates coming up so I think that adds to it.",1
domesticviolence,I’m just so exhausted and ready for this fight to be over.,1
domesticviolence,My friends and family don't understand why he is so jealous and controlling because they know when I'm in a relationship I'm faithful.,1
domesticviolence,"Im ready to take him out of my life, but what should I do?",1
domesticviolence,When hes angry I don't know what extent he would go to.,1
domesticviolence,How should I handle it?,1
domesticviolence,Ignore him or communicate calmly so he doesn't get mad?,1
domesticviolence,All of this has made me feel really horrible.,1
survivorsofabuse,I was going through a hard time after our breakup (started seeing a therapist and psychiatrist).,1
survivorsofabuse,He'd utterly lose control of himself.,1
survivorsofabuse,"Screaming so furiously I couldn't really understand him, grabbing me by the arms/shoulders and shaking me hard enough to give me whiplash, and continue screaming over me once I collapsed in a cowering heap when he let go.",1
survivorsofabuse,No one knows I have these fears.,1
survivorsofabuse,He shows me he loves me in many different ways but this is so hurtful when I'm aware that it's ridiculous to have these expectations.,1
survivorsofabuse,I guess I'm afraid I'll never stop feeling this way and I'll end up hurt him.,1
survivorsofabuse,I'm sure it's because I have no practice at making friends and the history of relationships I have had feel laced with feelings of betrayal - so maybe I'm self-sabotaging a little bit.,1
survivorsofabuse,I finally feel like I'm a decent person.,1
survivorsofabuse,She wrapped her arms around me and cried for dear life I growled at him to stop at once for he had scared her..he tried to take her from me as he continued to yell and she would not let him touch her That was the final straw.,1
survivorsofabuse,I made a decision that I had enough of this fear and I was going to die fighting and not be afraid anymore.,1
