subreddit,text,label
domesticviolence,"I knew that he was scary when he would pray in front of me, yet the entire thing was an angry ATTACK on God (not trying to get into beliefs here, just what happened.)",0
anxiety,I havent been diagnose for anxiety disorder but i want to been on medication?,0
domesticviolence,I desperately want to help her with this situation.,0
ptsd,He talks about what he'd do to my abusers if he ever found them.,0
ptsd,"He hadn't brought this up in half a dozen trials, and even provided forged documents to prove my ex's innocence.",0
relationships,Paul and I saw each other less but kept in touch.,0
domesticviolence,"I tried to be empathetic and not accusatory, and have a conversation about his feelings and encourage self-reflection.",0
ptsd,But they aren't funding MDMA PTSD research.,0
ptsd,"We had our second child in 2015, after which an injury led to the discovery of a debilitating and incurable connective disorder.",0
domesticviolence,No one understands me.,0
domesticviolence,"The man he presented to me was one of principle (honesty, loyalty, your word is your bond, etc), always ready to protect and serve in whatever way necessary.",0
relationships,That's a lot.,0
anxiety,Each of us brought a friend to make things easier.,0
relationships,I don’t need forgiveness I would just like to move on I guess?,0
survivorsofabuse,I found that November and December were a struggle and because of that I planned to address my stuff by going to therapy starting in 2019.,0
survivorsofabuse,"That's why I was hoping that, if you're interested, you could send me stories of your experiences in an abusive relationship - no matter what detail you choose to send, it doesn't need to be anything ""epic"" and ""big"", it could be the smallest segment that you matter.",0
ptsd,Hello.,0
survivorsofabuse,"I went to sleep and woke up saying, ""Well, I guess we're going to see other people, then!""",0
relationships,"Jay, Marie, me and the husband were at another couples house.",0
relationships,"If I just got in shape, I know that I would be close to a 10.",0
ptsd,"Don't hesitate to answer these questions in the comments, or dm me.",0
anxiety,Lexapro was good.,0
relationships,(We've all recently moved to the area and don't really have family/mutual friends to stay with.),0
domesticviolence,"Then tonight, the HR chief is seriously worried about his safety (and my SO) in a way he wasn't before.",0
ptsd,"I have OCD, myself, to ensure that the subject will be treated with the tact it deserves.",0
ptsd,"So while everyone else went back to a mutual friend's house, I drove around looking for him.",0
relationships,"I know there is a risk no matter what I say, but how should I go about it gently.",0
survivorsofabuse,This includes a few years of therapy & ~6 months on sertraline.,0
relationships,I look forward to what the community has to say.,0
domesticviolence,"Weird title I know but I really couldn’t find any other way to describe what I’m feeling and I really struggled to think if I should post this on here or another group So for as long as I can remember I’ve always been attracted to women and only women I had absolutely no interest in men at all A few years back I had my first relationship which was really manipulative and physically abusive and I haven’t been on any dates since then Recently though (like in the last two weeks) it’s accused to me that bar an old crush from before my ex “kinda-sorta” coming back I haven’t found any women attractive at all in a while at least a year and whenever I see someone I would have normally found attractive I just get a nervous/uncomfortable feeling I can’t really describe I’m not sure if this is a response to how my ex used to get abusive if she thought I was attracted to her (like she’d insist I must want to rape her if I called her beautiful for example) and I know for a long time afterwards I felt disgusted with myself if I found someone attractive so this may just be the next step in that, like my mind doesn’t want me to feel bad for finding someone attractive so it stops finding people attractive",0
ptsd,"I could be stretching, but I feel like this ""combat"" response as opposed to my old ""theft"" or ""freeze"" response even carried out the emotional aspects of my attacks.",0
anxiety,DSM-5 moved two more disorders to a specific group.,0
anxiety,You can choose how to improve yourself and that’s **backed by fucking science.,0
domesticviolence,"He drinks everyday, and my mother usually comes to me to vent about it.",0
survivorsofabuse,"Thank you kindly for your assistance, as your experience will be valuable in guiding research and clinical interventions for those in the foster care system.",0
domesticviolence,have the strength to say no.,0
ptsd,My own experience was six weeks ago.,0
relationships,"So, I had to take her home and pump her full of water and food and cross our fingers that she could get a draw in the morning.",0
ptsd,I'm just blown away by this doctor's willingness to help.,0
domesticviolence,He treated me like a dog.,0
anxiety,"Meditation - I would download head space the first 10 sessions with it are free and you can decide if you want to continue or not for a fee, but it is a good starting place for beginner mediators.",0
domesticviolence,It was subtle at first but it scared me.,0
relationships,"However, Matt's BO literally follows him around and lingers where ever he goes.",0
domesticviolence,"It was at that time that I started asking him more about it, how it was (I think I was pretty boring TBH,) and he would say he paid a lot of it.",0
relationships,"On top of it, I was not asked if I would be a pallbearer, I just found out via my sister that I would be one.",0
domesticviolence,Not really guess!...,0
survivorsofabuse,How does one go about becoming more comfortable around men?,0
survivorsofabuse,I tend not to like driving long distances in cars with people in unfamiliar places still but I feel good just that I am back on the road even if I don't drive the car.,0
relationships,**I spent the next half hour desperately thinking up backstories I could use to explain to my mother why I had a brand new hat.,0
domesticviolence,"But this time, I resisted.",0
domesticviolence,YET I STILL TALK TO HIM.,0
survivorsofabuse,I always blame carpal tunnel.,0
relationships,"So I don't want to do it unless it's you know, really what's needed.",0
anxiety,I am currently 15 years old and man.,0
relationships,"Listen, I've known B since high school, I've known her longer then my brother.",0
relationships,Recently I've tried reaching out to a lot of people but almost all of them will decline my offer to hang out at some point.,0
ptsd,in a store.,0
domesticviolence,I don’t expect this to ever fully go away but I am 18 now and I can say that I survived this.,0
relationships,).,0
relationships,Any suggestions?,0
survivorsofabuse,"Both girls had quit a couple of months into their jobs, even though they were doing well, seemed happy and very much liked their positions.",0
ptsd,Nothing He kicked the door 18-36-30 He kicked it again and until he was sure his foot would bruise Calm down,0
domesticviolence,"We've also been busy building up partnerships in the security sector, which will allow us to bring even more resources to the audience we serve.",0
relationships,"It's been five years and I still have this problem, what should I do?",0
survivorsofabuse,"I was very flattered because this man was absolutely beautiful and had muscles that had to be carved by Kratos himself, but alas, I was not able to give it as it was the company's policy.",0
survivorsofabuse,"(Anonymously, of course!",0
anxiety,I've been taking Sertraline (Zoloft) for about 10 years now.,0
survivorsofabuse,On my mothers side of the family I have an aunty and my nene along with various cousins.,0
ptsd,"Of course I still have some problems, but everything in life is balanced and peaceful.",0
ptsd,Today was different.,0
relationships,"For example, when I suggest we do something or go somewhere that could be somewhat unique/interesting (e.g., watching a documentary about sex workers in their 60s, or going to a church in Vienna to listen to the choir boys sing), his first reaction via text is ""wtf?""",0
ptsd,They love you and are very loyal to you.,0
survivorsofabuse,I have the inner-peace I was seeking for decades!,0
relationships,"I told him a million times, when we were together and after we broke up, that loyalty is my #1 in relationship, period.",0
survivorsofabuse,"Now that I texted him, that I opened that door again.",0
relationships,All this really feels effortless.,0
domesticviolence,He hides me from his friends and his friends reject me but all he says is I do not like his friends.,0
ptsd,The latter is still true but I make it a joke.,0
anxiety,I'm a 24 yr old female and I've never had a person I could call a friend in my life.,0
relationships,"In short, it seems like because of her past relationships, she kind of has an unhealthy mentality around 'earning' affection, and definitely has some sort of commitment issues (apparently her last ex said that he didn't really love her for the last year of their relationship, but was too afraid of hurting her to break up with her).",0
ptsd,"My original post made it sound like they are not supportive of me and my healing process, but they very much are.",0
relationships,Though we both had crushes on each other we weren't sure if the feelings were reciprocated.,0
ptsd,"Hi everyone, (edit: the title should say “after reading the symptoms” btw).",0
survivorsofabuse,I spoke at a college about recovery a few years ago.,0
anxiety,"Summary: - Have been working at a factory job for 1 month, hoping it would be a career change.",0
ptsd,Actually I'm not sure if that's what it really is.,0
relationships,"She wants to live off these 400.00 and cut back on everything there is, even her own only connection back to her family if needed.",0
relationships,Eventually I moved back with my dad and everything was fine.,0
domesticviolence,This made him even more mad.,0
anxiety,Does anyone else experience this?,0
survivorsofabuse,"Then right after, said “do you think I made you feel like that ever?” Then got noticeably nervous.",0
domesticviolence,"In my mind I think ""if only"" or ""what if"" but I know those are facades.",0
ptsd,"Everything, I love this guy, he was a good manager for me, I got all my increments since I was under him, he has children, so he understands me as a parent, etc.",0
ptsd,I also have been taking Zoloft 25mg for 12 days.,0
relationships,"It was a couple type thing and all of us were bringing a SO or a friend (if one of us didn’t have a partner) even if it wasn’t, I would have just wanted it to be Harry.",0
ptsd,I know the rules say no self-fundraising posts but I thought this might be an exception.,0
relationships,It really wrecked me that she would consider that.,0
ptsd,I thrive.,0
relationships,A few days ago she asked if her and my nephew can come spend next Monday - Friday with me because her BF is going out of town and she doesn't want to be in the house alone without him (they live with his family so I guess sometimes it gets uncomfortable).,0
relationships,She would complain about feeling like a caregiver for him (he was seriously depressed to the point where she had to make doctor appointments for him) and always talked about wanting to be with someone who was more independent and had their life together.,0
ptsd,"I know that small businesses are still required to follow ADA standards for customers, but does the same go for employees?",0
survivorsofabuse,"She hated the person she had become, and she was shocked to learn the number of years she wasted on him.",0
domesticviolence,He said it today.,0
survivorsofabuse,After a few months we decided to meet so I (with the gracious help of my parents) booked a flight to visit her in Germany.,0
anxiety,Also thank you for reading this post in general!,0
relationships,Lots of drama.,0
ptsd,.,0
anxiety,"At first it's difficult to hear, because your mind is focusing on your heartbeat, but after a little while you adapt and your heartbeat stops being the center of your attention.",0
domesticviolence,They are both less than 21.,0
domesticviolence,"In my case, I have sworn to myself to never become like my father, but I still have these... well, issues.",0
domesticviolence,"She has been in contact with womans refuge, unfortunatly there is not alot they can do because she does not want to leave.",0
domesticviolence,"When he met my friend, he was on house arrest/probation for a previous charge.",0
ptsd,"One of the couples I know is made up of cancer survivors:  the male had cancer as a child, thankfully beat it, but developed PTSD from the experience; the female has had 2 different battles with cancer (brain and breast), beat them both, but suffers from significant developmental issues (including cognitive delay and balance issues).",0
domesticviolence,"The kicks to my face came about every 15-20 mins, when he would work himself up while yelling.",0
relationships,"If we do move I would be fine with getting a full-time job to support my family, I’m already a private tutor but I only do 1-hr a week for $20.",0
anxiety,I've been trying multiple medications for 20 years and I have literally tried them all.,0
anxiety,"I got a call a few days ago, but I couldn't get an appointment because during the call the lady hr received an email that the person I would interview with would not be available and I didn't have my work schedule right in front of me so we decided to talk again the next day, once we both had an idea what the schedules for each side would be.",0
relationships,"We will call my girlfriend ""Linda"".",0
anxiety,I have been taking Sertraline (Zoloft) for about 10 years now.,0
relationships,Everything was absolutely perfect.,0
ptsd,That's the only way I've found temporarily deal with it.,0
relationships,"I am not without qualifications, but her recommendation certainly helped.",0
relationships,"Never thought I'd find someone I might actually be interested in and haven't met someone from Tinder in a few months because I don't love the thought of it, wasn't meeting the kind of girls I really want to date and I'm not getting any younger.",0
relationships,I always try to find ways to accommodate her busy schedule.,0
ptsd,My family thought it was a home invasion so the retrieved their guns and prepair to defend them selves.,0
ptsd,"In the dream, he kept telling me to do it as he cut himself deeper and deeper in his arm.",0
relationships,"Problem: Should I get into a LDR with her, or we should continue being best friends( which would be hard because she has already very clearly confessed she loves me) problems are: 1.",0
domesticviolence,There was something about the way she said it that seemed a little far away - as she had practiced her excuse (or maybe it was in my head).,0
relationships,"Not even three weeks ago, he sent me messages asking me to meet again, and I think with my heart not my head, said yes.",0
anxiety,"We used to see each other multiple times a day, when we were both in the flat we used to spend loads of time in each other's rooms just chilling and chatting.",0
ptsd,But this is a cry for help: what should I do?,0
ptsd,And everyone was passive aggressive.,0
relationships,I didn't take it as offensive.,0
domesticviolence,"I'm the only one that has seen that side of her, maybe I'm just the cause.",0
ptsd,"And if there isn't something like that, how do you guys cope or manage with that?",0
domesticviolence,My grandmother would tell me stories about having to be the one that cleaned the blood from the walls.,0
ptsd,.,0
anxiety,"It took me some time to find a psychiatrist who accepted the patients, but I finally saw one yesterday.",0
survivorsofabuse,My parents HATE each other so I have never had a good relationship with either of them.,0
anxiety,"Hi, so I’m a guy (mid 20s) whose been in a relationship for over 2 years with my girlfriend.",0
relationships,But I don’t know why I get this feeling.,0
domesticviolence,She comes crying to me and formulates a plan to break up.,0
domesticviolence,He recognizes and plays with his daughter from his age of six months.,0
ptsd,The study is the recruitment of adult veterans who suffered trauma during military service.,0
survivorsofabuse,She said there was nothing more she could do.,0
anxiety,"Last trimester, I started the club (Anime/Manga Fanclub) and we received an email with the activities that had too many people signed up.",0
relationships,"I don't ""feel"" in this anymore, but I honestly can't tell if I just can't let bygones be bygones or if I'm looking at this objectively.",0
relationships,I'm just confused.,0
relationships,Any idea how to stop getting myself in these situations?,0
anxiety,I'm a 28 year old male.,0
relationships,She responded to his offer by saying “how about we meet halfway and grab some lunch together some time”.,0
domesticviolence,Hey y'all.,0
relationships,My mum and older sister uses guilt a lot.,0
relationships,Not her shrink or doctor.,0
domesticviolence,But he told me it is because his step dad hits him so getting in fights gives him a weird sense of worth.,0
anxiety,At least I get that thought from the point of view of a society.,0
relationships,"However, although all of this, some thoughts keep coming at me.",0
anxiety,"Today, I got a haircut.",0
domesticviolence,We're both military members.),0
domesticviolence,Today at work I took a customer's payment over the phone.,0
anxiety,"This is obviously an alt, but I just wanted someone to hear if anyone.",0
ptsd,Please watch & subscribe!,0
ptsd,He was living in his car and I was jogging one evening he approached me and he confronted me.,0
domesticviolence,He hid snacks and 420 from me when I did most of the purchasing.,0
ptsd,Do I do too much from that?,0
relationships,"But after a while, some personal stuff got in the way of his life and he took a break from the drinking/partying etc.",0
relationships,"Three of them said ""so sorry I actually can't"" and gave some noncommittal excuse, whether that was work or school related (even though school only started up again about a week ago and midterms are far away).",0
relationships,"However, they've never been out rightly malicious towards me.",0
anxiety,At first i thought it was a physical injury so I went to the doctors and had an xray but they could not find anything.,0
relationships,I've met guys who I didn't feel attracted to and then started to really like because of their personalities (and vice versa).,0
anxiety,"I won't lie that I'm afraid, but I think it's time.",0
anxiety,I quit my antidepressant and my Pregabalin  a few weeks ago.,0
ptsd,"Good memories that were ruined when he stopped hiding his temper, when I became the outlet to his anger.",0
anxiety,"I have bipolar I as well, so it's likely that's the cause of the hallucinations.",0
survivorsofabuse,"Most diagnoses, except those relating to the endangerment of children, are welcome.",0
relationships,"She knows I love her still, she knows I'd do just about anything for her, and want to be with her still to this day but nothing more than just an option.",0
survivorsofabuse,"I would have survived, I always have before, I have gone three and four days without eating a single thing on dozens of occasions in the last fifteen years, and I will be fine.",0
anxiety,"Whenever we Skype, just talking to him feels like home, and talking about the upcoming trip feels just exciting, not nerve-wracking.",0
anxiety,This teams has proven their trustworthiness multiple times and always ask before touching or going through any of my things.,0
survivorsofabuse,"But several times, he asked her to work late or to visit his office when he knew no one would be around.",0
relationships,"I don't want to break up because other than this one problem, he's a wonderful partner and I really like my time with him.",0
anxiety,Has anyone of you guys ever experienced this self-confusion before and can help me finding myself again?,0
domesticviolence,"I had pictures which the officers asked to see, which I showed them.",0
anxiety,"I will browse a book on a subject that I want or need to study, research it, think about how it's going to be, then when the time for studying comes, I'm thinking about something else.",0
relationships,B said he was falling for her.,0
domesticviolence,"We hit it off, and it wasn't long before a date turned into two, then more.",0
relationships,"I'm (16M) openly gay, he (16M) isn't.",0
ptsd,"How long would you be willing to give (ask because a survey can take up to 30 minutes, but an interview can take up to 2 hours)?",0
anxiety,"I've also heard Trazodone may be an option, for someone who wants SSRI-like-effects without any activation.",0
anxiety,Again understandable.,0
relationships,"C - Harsh, sudden, loud expression of dissatisfaction.",0
relationships,"For the last year, I've been in a high-profile, high-stress management position with my company.",0
anxiety,#NAME?,0
domesticviolence,"Also, to answer the million dollar question everyone has, ""How does this happen to someone who outearns her abuser by a factor of 6?""",0
domesticviolence,Does anyone else feel like this?,0
survivorsofabuse,"If anyone wondered why I didn't know, I thought I wasn't clear in what I was saying and I thought that if I said it frankly, it would understand and go.",0
ptsd,"He at home, go into my bed and lie down there and watch a TV show or another while I'm on my phone.",0
ptsd,Allow yourself to be here fully in this moment.,0
anxiety,"I run marathons, kill it at the gym, learn languages and study for degrees in my spare time.",0
ptsd,I even tried to settle this outside of their insurance so that their insurance rates wouldn't go up.,0
relationships,"--- TLDR: SO has two colleagues with romantic feelings for her, one of which seems emotionally deceived with me.",0
domesticviolence,"I released this apartment, and most of my stuff (I kept a few boxes of my army stuff, personal effects, but few others).",0
anxiety,Reading other's struggles and accomplishments inspired me beyond belief.,0
anxiety,"My perceptual world changed, my reality became crisp, shiny, radiant yet also incredibly surreal.",0
domesticviolence,I have an answer for you.,0
ptsd,I'm not here for sympathy about what lead to my anxiety.,0
anxiety,Participants are only allowed to participate once in the current study.,0
domesticviolence,"Also, let me know if there's a better place for me to post this.",0
domesticviolence,Stage 4 cancer.,0
anxiety,I'm really not sure whether I should start to model myself over him or just remain like this.,0
ptsd,Especially the power of healing brought upon by service animals.,0
relationships,"One of her brothers lived in the 2nd house of her parents and left last year so we where fixing it (it was a completely mess, we had to spend a LOT of money to make it habitable.",0
relationships,But I also don't know if now I'm just second guessing because I'm just generally concerned about the future.,0
ptsd,"I'm sure as other survivors many of you are overcoming some of the same problems as well, and may have already had some of these realizations (of what makes you YOU) or are in search of them on your journey to becoming whole.",0
relationships,**,0
relationships,"Fine, then, I’ll never ask for anything ever again.",0
relationships,This lead him to feel more left out I am assuming.,0
anxiety,"My boss asked my lead, who is friends with that person about it.",0
relationships,"I always told her that if there was something she wanted to know, no matter how uncomfortable it could be, that I would tell her the truth and in return that she would do the same thing.",0
ptsd,"*Major trigger warning* I find comfort in confined spaces, and can spend prolonged time in confined spaces verycomfortably.",0
domesticviolence,We still have up until December on this lease together.,0
relationships,"However, he seems to have quite few girl-friends and he is friendly with them, but not to this extend I would say.",0
survivorsofabuse,One day we were at the park and he asked if I had a boyfriend I said no.,0
anxiety,Your mental health is YOUR mental health.,0
ptsd,"To make things worse, nine times out of ten that we do have sex is because I initiate.",0
ptsd,She didn't ask for help and even when my dad and I both offered she declined.,0
relationships,**tl;dr friend is struggling with alcoholism and bulimia.,0
relationships,I didn't grow up in a loving family like her.,0
domesticviolence,"During the walk she made a lot of threats about how she was going to call the police, put me in jail, even try to get me deported (I'm a LPR.)",0
relationships,"I didn't really want to tell her any of those, but I could not think of a reason why not to.",0
relationships,Should I text him or call him and ask him what happened that night?,0
domesticviolence,"I was so fucking scared and while he hid in the basement with all the doors locked and light off, the cops took pictures of my hands and neck while I asked them over and over not to arrest him.",0
relationships,"I'm a little wary of the age gap and don't have much experience with accurately ""reading signals"".",0
survivorsofabuse,He doesn't think badly of the men who sexually abused him.,0
anxiety,We had been going out for 3 years when we decided to break it off.,0
anxiety,I looked on the internet about anxiety in online games and there seem to be people who have it.,0
relationships,"That was another thing that surprised me because he always would open things in front of me, and never had a problem with me on his phone.",0
anxiety,I have an appointment to the cardiologyst but until then I'll have all my trial exams.,0
relationships,I told him I’m not using that on my makeup and my contacts stuff!,0
