subreddit,text,label
relationships,We specifically picked this date after looking at the average temperatures for that date for the last 5 years.,0
anxiety,"Oh, male and 20 mg daily for a year is my timeline with the meds.",0
anxiety,A useless person.,0
domesticviolence,I supported both him and myself in this new state while he was in school.,0
ptsd,And the next page There’s an outline of a human body.,0
ptsd,You guys are so wise and so strong and so endlessly kind to each other.,0
relationships,"Anyway, these pieces of information - that she pretty much opened up to me sexually only when she felt threatened by another woman, and that she has clearly been with other guys who she's had much more sexual interest in than me - pretty much led me to the alternate hypothesis that it wasn't the vaginal pain and the birth control so much as her lack of attraction to me in comparison to past boyfriends.",0
survivorsofabuse,But it felt like an intentional attempt to act like I am a burdensome charity case.,0
domesticviolence,I (30F) married my husband (31M) about 6 months ago after dating for 2 years and knowing each other for about 14.,0
relationships,"I love her dearly, and want to make this work, but I'm also worried that I shouldn't have gone this far into a relationship without a frame of reference for what I would want in one.",0
domesticviolence,"It was the summer, I had just started a new job as a bartender.",0
survivorsofabuse,"We hope to know if and how treatment preferences change over time, and whether the patient's perception of their treatment is consistent with their preferences is related to the benefit received by treatment.",0
relationships,"also this week I posted about being excited about going home for the summer and she replied with ""Super stoked for you to come home this summer (Winky Emoji).",0
relationships,"Whenever I ask her about us she says ""right now, no, but in the future who knows?""",0
anxiety,Or have you noticed any increase in Mirtazapine's appetite?,0
ptsd,How would you want the media to change?,0
anxiety,It took a while and a few arguments for me to open up a little.,0
domesticviolence,THIS IS IT!!!!,0
ptsd,He had slammed the kitchen knife into the wall and ran out to the woods behind his house.,0
relationships,"One of the things I noticed is that a lot of responses are brutally honest -- and I am here for just that while still accepting that I'm a hopeless romantic who sees the value in ""If you really want it don't give up"".",0
survivorsofabuse,Heavy exercise would defeat the fear in most cases or make it easy to manage.,0
relationships,"**Tl;dr** Found an okcupid profile for my husband, he denies knowing anything about it",0
anxiety,"I was dressing better, eating better, losing weight, dating a little, saving some money, I was on my way out of this pit.",0
survivorsofabuse,Getting this out seems to have helped a fair bit.,0
anxiety,"I am in the early stages of training a startup focused on mental health and well-being, and I would like to get the opinions of all of you.",0
ptsd,You know what you did!” I wish there would be witnesses and that they’d get to think about it.,0
ptsd,- Mum relied heavily on drugs and booze.,0
anxiety,"I'm a college student and apart from tuition I have food and other things to fund and I thought that by paying this much I'd at least get my money's worth in therapy, but other than telling him about my anxiety and family, and having him tell me I probably have OCD and Anxiety disorder, all I seem to hear is the rates of the therapies and how it would take over a year of dynamic therapy, preferably 2 times a week, at 80$ a session, and that I should be able to commit if I want to continue.",0
relationships,"To be fair, I was also a little closed off with them but mainly because I felt so unwanted.",0
anxiety,(he’s never expressed this.,0
anxiety,I know I posted something similar recently but writing in this subreddit really makes me feel less lonely.,0
survivorsofabuse,I thought about turning him in.,0
relationships,It was my fault she'd be single forever.,0
domesticviolence,I have been trying to find an answer to this question over 6 months.,0
relationships,However the things she were saying were very icky for my liking and I was uncomfortable about 10 minutes in.,0
relationships,Can/How I make her fall in love with me again?,0
ptsd,cheers if you read this.,0
survivorsofabuse,"Those who are local, or are willing to make the trip, we have Centre in Dundee where you can talk to volunteers and support staff in person.",0
ptsd,I hope others struggling in this thread know that what is going on in your life is temporary...it will pass.,0
anxiety,My partner has gotten quite good at gauging where I am on a scale of 1-10.,0
anxiety,Havnt had one in years.,0
survivorsofabuse,"If you qualify, you will complete a variety of questionnaires online.",0
domesticviolence,"I don't know exactly what she did to herself, but when the police came, she said I hit her and had a puffy cheek to show for her.",0
domesticviolence,"He never pursued it, however.",0
survivorsofabuse,"FollowIng healing art, there were 4 powerful guest speakers.",0
domesticviolence,Probation.,0
survivorsofabuse,IDK... <url>,0
relationships,They're just not the level of intensity I'm used to feeling when I fall for someone.,0
survivorsofabuse,my mom hollered at me to come help with something in the kitchen.,0
relationships,I get confused sometimes as to why in my teen years I was okay with talking to her.,0
relationships,"When we got to Food Lion, she got out of the car and said, “Your daddy bought you this car.” And slammed the car door and left.",0
relationships,"Nowadays, we only email each other about thrice a year, but I still consider him one of my favorite online friends because of how deep and insightful our conversations are.",0
ptsd,Who smiled and asked if there was anything I'd like to tell him.,0
survivorsofabuse,"I knew little that Pedo had looked at me from behind a clothing rack, and soon pulled me aside in front of all my colleagues in my retail section and spoke to me so firmly, he told me that that's why your life is so messed up, that's why everyone here thinks you're so easy.",0
ptsd,"Black tinted windows, darkened license plate, but looked out of the state.",0
anxiety,Do you just write the thought is there and why it isn't true?,0
relationships,"Sorry, this will probably be a little long.",0
survivorsofabuse,We were raised in the Bible belt and she believed every word they told her that it was normal.,0
ptsd,"Again, I worry they'll say that if I'm sexually active, I should be able to do this just fine.",0
relationships,Many times he has decided to hinder the business due to reasons related to what I mentioned.,0
ptsd,&nbsp;,0
relationships,"I meant this stuff, and I think I still sort of do.",0
ptsd,"My evaluator recommended I start with EMDR for the PTSD, but I have a few questions.",0
domesticviolence,"Once she called me and let go that she had been raped as well as hit, drugged, something about a trial, and what sounded for me like a lot of paranoia about the mafia and the government.",0
domesticviolence,Fast forward half a year at my break up.,0
relationships,TL;DR: I'm homeschooled lonely and can't join a sports team how do I make friends.,0
relationships,The next stab came when I was sent to an Air Force base for a 3 month training for my job.,0
ptsd,They chased me down an alley and found me hiding behind a truck.,0
relationships,I begin to remove the ornaments and put them aside.,0
survivorsofabuse,"If they were too ""bad"" they were not fed.",0
relationships,"A few months after starting the class, my buddy told me that Chloe has a crush on me, and gave me the impression that she wanted me to know about it, however, even after that, she didn't try to talk to me or get noticed at all.",0
ptsd,<url>,0
anxiety,"I started learning how to drive 4 years ago, and it was okay until I got this driving instructor.",0
relationships,My father was planning to tell me when I arrived for the visit.,0
relationships,But she sometimes tries to grab food off the table if people aren’t around.,0
domesticviolence,He grumbles and yells only on his 'nervous' days.,0
domesticviolence,?,0
relationships,"She took it as cheating and to this day, goes back to it at every argument we have.",0
domesticviolence,And your will to live/be safe/feel safe will go over any trauma you've suffered.,0
anxiety,Have someone had the same problem?,0
survivorsofabuse,"He said I’ve ordered an uber for us, which I thought I was being dropped back at home; I don’t actually remember the ride home in the Uber.",0
domesticviolence,"my parents let him live at home when his parents threw him out, and he started dating the girl I really loved behind my back.",0
survivorsofabuse,Yoga and meditation helped me to get rid of fear too.,0
relationships,"She didn’t have room for it where she was currently living, it had been so long since she was able to create.",0
relationships,I broke my ankle and injured my knee.,0
relationships,"For many years, I visited her and asked her if she could do anything to alleviate my allergies (by keeping the cat out of ONE room - where I slept, not giving myself clothes to wear that cat had slept, vacuuming) and she didn't do anything.",0
relationships,"And it may be a bit out of context, but I do have to thank my 4 best men for being here with me all the way, I couldn’t do this without them.",0
relationships,"I kept calmly assuring him that we were fine, and that I just needed rest that night.",0
relationships,She did things she wasn't supposed to do.,0
ptsd,"You see Kim checking her ACE score, meeting Donna Jackson Nakazawa, and especially in therapy, using EFT (tapping) and neurofeedback.",0
domesticviolence,"Even when (now talking about other times) I tried to be playful and like the dreadful stuff, he was beating me for it.",0
ptsd,So thank you.,0
anxiety,"I'm different than most girls at my college, I guess.",0
relationships,"A few months after I told her about the other girl, I found out that she was actually still in a relationship with her ex.",0
anxiety,at least i think i do.,0
ptsd,"Whoever reads this, thank you.",0
survivorsofabuse,?,0
relationships,"I held her until she went back to sleep, and then stayed with her.",0
relationships,"One of his brothers lived in his parents' 2nd house and left last year, so we where to fix it (it was a complete mess, we had to spend a LOT of money to make it habitable.",0
relationships,She's going to start graduation school in August.,0
domesticviolence,"The family has been blaming me for my abuse, denying it happened, threatenung me into changing my story, and generally defaming my character.",0
ptsd,Thank you for reading.,0
anxiety,"Articles by Dr. Fred Penzel <url> A leading expert in OCD, Dr. Penzel has a collection of excellent online articles based on years of successful treatment of patients with OCD.",0
ptsd,"I asked if I could say goodbye to my nieces and nephews and friends and she said ""no.""",0
domesticviolence,He played nice for my vacation-- respecting my boundaries and acting only as a friend.,0
domesticviolence,"Fortunately, the police were able to put together what really happened on my blood trail.",0
domesticviolence,"I know now, it was all you.",0
relationships,She called me the next day and was so grateful and loved.,0
anxiety,i probably havesevere gad.,0
ptsd,Attachment and a secure base are the two things a PTSD survivor does not have.,0
relationships,"He is (objectively) pretty unlikable- only talks about himself when speaking to you- but you know, I try to see the best in people and ignored it when I talk to him.",0
anxiety,"I've never lived in a place like this before because it's an en-suite with my own double bedroom and bathroom, but the kitchen and lounge is shared with about 15 other 'profressionals' It's right in the centre of a bustling city near all the bars and music venues.",0
survivorsofabuse,"And yeah, not everyone has them.",0
ptsd,I know what it means to plunge into yourself.,0
ptsd,Here's a homebaked metaphor.,0
ptsd,Has anyone found something that works for them?,0
relationships,I've never been okay with it and i feel like I've been lead on throughout this entire relationship.,0
survivorsofabuse,One part of what makes a good writing is to have small specific details and the little stories that make up the novel as a whole.,0
anxiety,"As for the strange symptoms that I had after taking the 2nd pill by accident, she said that ""since 20mg is already the maximum dose of Lexapro, taking 40mg could produce psychotic symptoms"".",0
relationships,It's been so freaking long since I considered sex as a thing it actually makes me nervous.,0
relationships,"Sports teams, mostly, and some TV shows.",0
survivorsofabuse,In that split second the young teenage boy fell in love with a shy teenage girl.,0
relationships,She has refused medication which made her flares better for fear of the side effects (palpitations).,0
ptsd,Poodle would be good for allergies like many of my close family have allergies.,0
domesticviolence,He kicked me and spat on me.,0
relationships,"But now that we're close to the point of no return, with a flight booked so he can come see her(I agreed to travel out of our house for the week), and they seem to be bonding big time(I love you's abound), I'm not sure what to do with myself.",0
domesticviolence,I was going to let you keep my puppy.,0
anxiety,"Not that you should bother with the later parts, either.",0
ptsd,He's different.,0
survivorsofabuse,I really hope he finds his way in the hands of those who are most in need.,0
anxiety,Are there any recommendations I should bring up with my doctor?,0
anxiety,!,0
anxiety,P.S.,0
ptsd,They leave needles out everywhere and when I inevitably step on one I'll probably end up with an STD.,0
relationships,"Like I said, I love Alice and I didn’t think much of it.",0
domesticviolence,"I digress, I demanded that he give me a face to excuse faces.",0
relationships,"Of course, now K is having an online ""role playing relationship"" with some lady on Grand Theft Auto RP.",0
relationships,She said she had to know and I told her that I would do it but she couldn't turn it into a problem because all this happened before I even knew her.,0
ptsd,Send good vibes please?,0
domesticviolence,"But that night, I had a wave of courage for two seconds and told the staff what really happened.",0
relationships,"We talked about the extra money he’d be able to save by walking to work (2 mins away,) and it seemed as though we were on the same page for what we wanted in the future; buy our own place, a car and start a family.",0
anxiety,Multiple psychiatrist and even my pharmacist are stumped.,0
ptsd,"Basically, if you take any meds you get treated like a black sheep.",0
anxiety,"My therapist asks me point blank what I want to talk about, so I talk about the things that were bothering me in the last two weeks.",0
domesticviolence,I talked about how I suffered from depression in graduate school and compared my symptoms of increased irritability and desire to stay at home with his current behavior.,0
domesticviolence,"Ive been financially abused in small ways for almost a year, paying more than my share, while he saved.",0
domesticviolence,I'm in a well paid job.,0
ptsd,"And again, mods, if it's not appropriate, let me know and/or point me to a better sub!",0
relationships,"She told me she was excited, I was just more excited about it.",0
survivorsofabuse,"Please note: If you participated in this study at any point in 2016 through Vanderbilt University, unfortunately you are not eligible to participate again.",0
survivorsofabuse,It was 3 times the size of the one that burned down.,0
relationships,"On one of my work trips, I went for two weekends.",0
domesticviolence,"But there have been dark parts of our relationships, of which I am stunned to speak.",0
domesticviolence,I got connected with the DV shelter in town to connect to my Crime Victim funds so I don't have to worry about therapy co-pays and I'm filled to the brim with anxiety about class tomorrow.,0
survivorsofabuse,"He says it's so rewarding for him, but it's really open about how hard it was as well.",0
relationships,"So 2 minutes into her exploding, she starts crying because apparently her brother told their dad something and the dad called her and said he doesn't trust her anymore or whatever.",0
relationships,"We've known each other for 9 years, were FWB for about 3 years, then moved into the committed monogamous relationship we're in now, and have been in for 2 years.",0
domesticviolence,He even cleans up the messes she makes when she smashes his stuff.,0
ptsd,I usually react badly to anniversaries of incidents that involve being blamed for someone dying.,0
anxiety,Please leave a comment below or DM me if you're interested in being interviewed!,0
ptsd,PEOPLE WHO ABUSE ARE SOME OF THE MOST MANIPULATIVE AND BELIEVABLE LIARS.,0
anxiety,What do you do when this happens?,0
relationships,I was still getting to know her and there was a lot to figure out.,0
domesticviolence,Things have been going somewhat civil ever since.,0
domesticviolence,"She requested to go to the bathroom right away, and we helped her with that.",0
anxiety,"Even when I’m off, I still do chores and such between playing games.",0
anxiety,"And there I was, thrust into the middle of a world so overwhelmingly vivid that I yet felt so overwhelmingly absent from.",0
domesticviolence,Except my grandparents died when I was 8 years old (both within the span of 5 months of each other) and my music teacher had to quit his job as he was struggling economically.,0
domesticviolence,"The best I can do is wait it out until someone dies, I suppose.",0
domesticviolence,"Neither of us got much sleep that night, and when I tried to talk to him in the morning about leaving, he got really agitated and raised his voice to me.",0
domesticviolence,"I received a message pleading for a conversation, no explanation on what.",0
domesticviolence,When she felt the cuts on my wrists in the dark on night she asked if I was cutting ?,0
relationships,If he didn't want to cheat or chickened out at the last minute why would he carry on so long with me?,0
anxiety,But I could feel construction workers staring at me.,0
ptsd,"That is not because he never does, that is how much I turn him down.",0
domesticviolence,I was out of his league (his words).,0
ptsd,"For those that have sought help before, is it as bad as I am imagining?",0
relationships,I have a lot on my mind.,0
relationships,"I met ""Bob"" in a big city, moved with him to the property of his parents to start a business / farm.",0
relationships,I want to provide some background from my side of these events.,0
ptsd,I began therapy at 10 and over the years tried more medications than I can possibly recall with no success.,0
relationships,Is it even possible?,0
anxiety,Anyone do anything like this?,0
ptsd,Has anyone did this kind of treatment?,0
domesticviolence,He used to be the funniest and happiest guy around and now he is just broken.,0
relationships,Met in hotel room.,0
anxiety,Don't hesitate to share!,0
anxiety,"I understand that not everyone sees mental health the same way, but believe me, even if it feels like no one is on your side, we all are.",0
survivorsofabuse,"My ex and I broke up because he never liked to leave the house, even for daytime activities.",0
relationships,"But unlike her father, she is neither electrician nor certified plumber, nor particularly qualified in carpentry.",0
survivorsofabuse,"Pads, new clothes for school, new glasses, ect.",0
relationships,"My mom [54F] has catered to his every need since marriage, and although she complains about it constantly, she still goes along with it.",0
survivorsofabuse,"If a subreddit (or another site) helped you really understand/realize that your situation wasn't normal, would you be willing to DM me?",0
relationships,Will sleep on it and hopefully tackle with a clearer head tomorrow.,0
survivorsofabuse,"When I dare to open up to my friends, they tell me ‘Oh, my brother used to fight with me too’ and I feel diminished and dismissed.",0
domesticviolence,Babies don't care about work hours you know.,0
domesticviolence,"In fact, I remember him telling me to shut up.",0
relationships,"Should I provide screen shots of our conversations right off the bat, or wait and see if she requests it?",0
relationships,My online friend  -- let's call him Jim  -- is a Jehovah's Witness.,0
anxiety,"In regards to the strange symptoms I had as a result of taking the 2nd pill by accident, she said that ""since 20mg is already the max dose of Lexapro, taking 40mg could produce psychotic symptoms.""",0
anxiety,"And remember that elections in the US are in exactly one week, November 6.",0
relationships,**Some Background:** I have a co-worker we'll call Pamela.,0
ptsd,Telling parents is not an option.,0
ptsd,I would volunteer my services to learn more by working with sufferers.,0
domesticviolence,he still holds me back in life.,0
domesticviolence,She showed us pictures of bruises.,0
survivorsofabuse,It was the final straw.,0
ptsd,"__Target group__: _(PTSD sufferers, military vets)_ __Compensation__: _(raffle, payment)_ __Link__: _(how to access survey)_ __Background__: _(why are you doing this survey?",0
ptsd,It makes sense to see danger around every corner.,0
relationships,"Plus, we’re using his car, which will eventually result in the usual wear and tear and expenses.",0
ptsd,He doesn’t know anything about that though.,0
survivorsofabuse,!,0
ptsd,After about 6 years of this happening I've become a virtual prisoner in my own house.,0
anxiety,Once in the bar I saw a group of guys sitting with them.,0
anxiety,Not standing in the middle of a locker room getting ready to cry because you saw a lock on the locker you use every time you're at the gym.,0
survivorsofabuse,when you can purchase it for only $0.99.,0
anxiety,Thanks ahead of time for any help.,0
domesticviolence,"He lets go, and we scream a bit more.",0
relationships,"for me, I have the impression that it is someone older than my present age from an age that seems to me to be a child....",0
ptsd,"I eat dinner, then rest in my bed until I decide to go to bed.",0
survivorsofabuse,Do you forgive me?,0
ptsd,And advice about how to deal with the impact of this on myself?,0
domesticviolence,"tl;dr: my [30M] partner is abused by his wife [28F], but is convinced to continue to try to make him work despite the situation negatively affecting his own mental health.",0
survivorsofabuse,I was granted a restraining order against him (and it was renewed a year later) but I was unable to press criminal charges against him because I didn’t have enough evidence to have a case.,0
relationships,Everyone I work with says she loves me.,0
relationships,"Well, didn't find the one.",0
relationships,"However, it seems to have few friends daughters and it is friendly with them, but not to this extension I would say.",0
domesticviolence,"So if you go to Walmart to get a burner phone (or when we provide one, in some cases), you can install it on that device as well.",0
ptsd,"You may think, well that's weird, but that's not the abusive part.",0
relationships,"I crawled her facebook and it seems to be a 23-year-old ""normal""... going out to party... saying things that I would have found funny at that age but now fearing... and he shared with me that he supported her for most and so on...",0
relationships,I've always been told that I'm mature for my age and have never been anything near a problem child.,0
relationships,The one thing about him that would have seemed “off” is that he never really talked at all about his life before the Army.,0
relationships,I feel like I'm grabbing at straws.,0
anxiety,"Then I started reading more books to improve myself, and that was when I started to earn some savings.",0
relationships,"When I'm single it's never an issue if a person I'm seeing is sleeping with others but as soon as I fall in love, I can get kind of possessive.",0
survivorsofabuse,Part of what makes good writing is having small specific details and the little stories that make up the novel as a whole.,0
domesticviolence,They then had a slideshow with pictures of some of the survivors.,0
ptsd,I distinctly felt it.,0
survivorsofabuse,"Thing is, i was never meant to be here.",0
domesticviolence,This is my story I feel I should share in the case things every turn bad.,0
domesticviolence,"So, talked to my therapist about this and I had already told the DA I want him to see jail time not just 2 years of probation with state mandated drug treatment.",0
relationships,Then March happened.,0
ptsd,"To join visit our site [https://thehaven.support](https://thehaven.support/) or check out our Instagram: <url> We believe we are stronger together, which is why peer support is so helpful and important.",0
survivorsofabuse,And he saw it in my eyes.,0
survivorsofabuse,He would make me pull down my pants and he would whip me until I was hysterically crying in pain.,0
relationships,BACKGROUND: paul and i met 1.5 years ago on okcupid and hit it off right away.,0
anxiety,Knowing I can never experience it the same way again makes me not want it to end.,0
relationships,"That she should stay with her family, that I didn't want her to go with my family so she doesn't have to worry anymore.",0
relationships,There became two sides of me I battled within myself.,0
anxiety,I’m doing that awful thing where you just avoid avoid avoid.,0
relationships,My husband outwardly reserved/introverted but he's also very goofy around me.,0
domesticviolence,I am afraid to even begin for several reasons.,0
anxiety,What did you end up doing?,0
